{
  "asset_page": "https://opengameart.org/content/particle-pack-80-sprites",
  "creator": "Kenney",
  "license": "CC0-1.0",
  "license_evidence_url": "https://opengameart.org/content/particle-pack-80-sprites",
  "verified_at": "2026-09-28",
  "download_url": "https://opengameart.org/sites/default/files/kenney_particlePack.zip",
  "reviewer": "EXAMPLE: replace with actual reviewing agent/person",
  "review_notes": "Template only. Reopen original page, confirm scope and actual download, record findings and current date before setting review_complete true.",
  "review_complete": false
}
